{
 "format": "OpenNAT projet 1",
 "projet": {
  "identifiant": "cas_7b",
  "nom": "Cas 7b. Même bâtiment en bois, origine non justifiée"
 },
 "contexte": {
  "zone_biogeographique": "continentale",
  "typologie": "logement",
  "zone_climatique": "H1a",
  "sol": {
   "texture": "limon",
   "profondeur": 1.0
  }
 },
 "parcelle": {
  "surface": 3000
 },
 "chantier": {
  "annee_debut": 2027,
  "mois_debut": 9
 },
 "gestion": {
  "plan_annees": 10
 },
 "taches": {
  "J": {}
 },
 "etat_initial": [
  {
   "id": "I1",
   "code": "E2.6",
   "position": "sol_pleine_terre",
   "surface": 3000,
   "tache": "J",
   "score": {
    "satisfaits": 4,
    "applicables": 7,
    "essentiel_echoue": false
   }
  }
 ],
 "options": {
  "tirages": 0
 },
 "batiments": [
  {
   "nom": "Bâtiment",
   "sref": 4000,
   "emprise_au_sol": 1000,
   "duree_chantier": 18,
   "ges": {
    "A1-A3": 400,
    "B": 300,
    "C": 70
   }
  }
 ],
 "variantes": [
  {
   "nom": "Projet",
   "reference": true,
   "unites": [
    {
     "id": "P1",
     "code": "VB.1",
     "position": "sol_pleine_terre",
     "surface": 1000
    },
    {
     "id": "P2",
     "code": "VB.2",
     "position": "sol_pleine_terre",
     "surface": 600
    },
    {
     "id": "P3",
     "code": "VB.7",
     "position": "sol_pleine_terre",
     "surface": 1400,
     "tache": "J",
     "score": {
      "satisfaits": 2,
      "applicables": 3,
      "essentiel_echoue": false
     }
    }
   ],
   "materiaux": {
    "bois": [
     {
      "regime": "coupe_rase",
      "volume": 900,
      "remplacements": 0
     }
    ],
    "granulats": {
     "masse": 2500
    }
   }
  }
 ]
}