{
 "format": "OpenNAT projet 1",
 "projet": {
  "identifiant": "cas_1",
  "nom": "Cas 1. Friche urbaine imperméabilisée devenue résidence avec jardin"
 },
 "contexte": {
  "zone_biogeographique": "atlantique",
  "typologie": "logement",
  "zone_climatique": "H2a",
  "sol": {
   "texture": "limon",
   "profondeur": 1.0
  }
 },
 "parcelle": {
  "surface": 3000
 },
 "chantier": {
  "annee_debut": 2027,
  "mois_debut": 9
 },
 "gestion": {
  "plan_annees": 10
 },
 "taches": {
  "F": {},
  "J": {
   "connexion": "moyenne"
  },
  "T": {}
 },
 "etat_initial": [
  {
   "id": "I1",
   "code": "VB.2",
   "position": "sol_pleine_terre",
   "surface": 2400
  },
  {
   "id": "I2",
   "code": "VB.1",
   "position": "sol_pleine_terre",
   "surface": 300
  },
  {
   "id": "I3",
   "code": "VB.8",
   "position": "sol_pleine_terre",
   "surface": 300,
   "tache": "F",
   "score": {
    "satisfaits": 1,
    "applicables": 4,
    "essentiel_echoue": true
   }
  }
 ],
 "options": {
  "tirages": 0
 },
 "batiments": [
  {
   "nom": "Bâtiment",
   "sref": 2200,
   "emprise_au_sol": 900,
   "duree_chantier": 20,
   "ges": {
    "A1-A3": 520,
    "B": 380,
    "C": 60
   }
  }
 ],
 "variantes": [
  {
   "nom": "Projet",
   "reference": true,
   "unites": [
    {
     "id": "P1",
     "code": "VB.1",
     "position": "sol_pleine_terre",
     "surface": 900
    },
    {
     "id": "P2",
     "code": "VB.2",
     "position": "sol_pleine_terre",
     "surface": 300
    },
    {
     "id": "P3",
     "code": "VB.3",
     "position": "sol_pleine_terre",
     "surface": 200
    },
    {
     "id": "P4",
     "code": "VB.6",
     "position": "sol_pleine_terre",
     "surface": 300,
     "tache": "J",
     "score": {
      "satisfaits": 2,
      "applicables": 3,
      "essentiel_echoue": false
     }
    },
    {
     "id": "P5",
     "code": "VB.26",
     "position": "sol_pleine_terre",
     "surface": 600,
     "tache": "J",
     "score": {
      "satisfaits": 5,
      "applicables": 6,
      "essentiel_echoue": false
     }
    },
    {
     "id": "P6",
     "code": "VB.7",
     "position": "sol_pleine_terre",
     "surface": 400,
     "tache": "J",
     "score": {
      "satisfaits": 2,
      "applicables": 3,
      "essentiel_echoue": false
     }
    },
    {
     "id": "P7",
     "code": "VB.19",
     "position": "eau",
     "surface": 200,
     "tache": "J",
     "score": {
      "satisfaits": 4,
      "applicables": 5,
      "essentiel_echoue": false
     }
    },
    {
     "id": "P8",
     "code": "FA.3",
     "position": "lineaire",
     "surface": 100,
     "tache": "J",
     "stade": "M",
     "score": {
      "satisfaits": 6,
      "applicables": 8,
      "essentiel_echoue": false
     }
    },
    {
     "id": "P9",
     "code": "VB.18a",
     "position": "arbre",
     "surface": 977,
     "tache": "J",
     "stade": "M",
     "score": {
      "satisfaits": 4,
      "applicables": 6,
      "essentiel_echoue": false
     }
    },
    {
     "id": "P10",
     "code": "VB.11",
     "position": "hors_sol_toiture",
     "surface": 600,
     "tache": "T",
     "epaisseur": 10,
     "score": {
      "satisfaits": 2,
      "applicables": 3,
      "essentiel_echoue": false
     }
    }
   ],
   "materiaux": {
    "bois": [
     {
      "regime": "coupe_rase",
      "volume": 40,
      "remplacements": 0
     }
    ],
    "granulats": {
     "masse": 3200
    }
   },
   "ouvrages_pluviaux": [
    {
     "surface_drainee": 700,
     "infiltration_surface": true
    }
   ]
  }
 ]
}